<?xml version="1.0" encoding="UTF-8"?>
<xs:schema xmlns:xs="http://www.w3.org/2001/XMLSchema">
	<xs:element name="list">
		<xs:complexType>
			<xs:sequence minOccurs="1" maxOccurs="unbounded">
				<xs:element name="event" minOccurs="0" maxOccurs="unbounded">
					<xs:complexType>
						<xs:sequence minOccurs="1" maxOccurs="unbounded">
							<xs:element name="parameter" minOccurs="0" maxOccurs="unbounded">
								<xs:complexType>
									<xs:attribute name="name" type="xs:string" />
									<xs:attribute name="value" type="xs:string" />
								</xs:complexType>
							</xs:element>
							<xs:element name="eventItems" minOccurs="0" maxOccurs="1">
								<xs:complexType>
									<xs:sequence minOccurs="0" maxOccurs="unbounded">
										<xs:element name="class" minOccurs="0" maxOccurs="unbounded">
											<xs:complexType>
												<xs:sequence minOccurs="0" maxOccurs="unbounded">
													<xs:element name="itemList" minOccurs="0" maxOccurs="1">
														<xs:complexType>
															<xs:sequence minOccurs="0" maxOccurs="unbounded">
																<xs:element name="item" minOccurs="0" maxOccurs="unbounded">
																	<xs:complexType>
																		<xs:attribute name="id" type="xs:positiveInteger" />
																		<xs:attribute name="amount" type="xs:positiveInteger" />
																		<xs:attribute name="enchant" type="xs:integer" />
																		<xs:attribute name="augmentation" type="xs:string" />
																		<xs:attribute name="elementals" type="xs:string" />
																	</xs:complexType>
																</xs:element>
															</xs:sequence>
														</xs:complexType>
													</xs:element>
												</xs:sequence>
												<xs:attribute name="id" type="xs:integer" />
											</xs:complexType>
										</xs:element>
									</xs:sequence>
									<xs:attribute name="name" type="xs:string" />
									<xs:attribute name="team" type="xs:integer" />
								</xs:complexType>
							</xs:element>
						</xs:sequence>
						<xs:attribute name="id" type="xs:integer" />
						<xs:attribute name="nameEn" type="xs:string" />
						<xs:attribute name="nameRu" type="xs:string" />
						<xs:attribute name="impl" type="xs:string" />
					</xs:complexType>
				</xs:element>
			</xs:sequence>
		</xs:complexType>
	</xs:element>
</xs:schema>