<?xml version="1.0" encoding="UTF-8"?>
<list xmlns:xsi="http://www.w3.org/2001/XMLSchema-instance" xsi:noNamespaceSchemaLocation="../../xsd/fight_events.xsd">
	<event id="5" nameEn="Treasure Hunt" nameRu="Поиск Сокровищ" impl="FFATreasureHunt">
		<parameter name="icon" value="Icon.event_hero_treasure_box_i00" />
		<parameter name="descEn" value="Need find chests and open them. Points are also given for killing players!" />
		<parameter name="descRu" value="Необходимо найти и открыть сундуки. Также даются очки за убийство игроков!" />
		<parameter name="roundRunTime" value="10" />
		<parameter name="isAutoTimed" value="true" />
		<parameter name="autoTimes" value="0 4,16 * * *" />
		<parameter name="roundEvent" value="false" />
		<parameter name="teamed" value="false" />
		<parameter name="useBuffs" value="false" />
		<parameter name="dispelBuffs" value="true" />
		<parameter name="givePvpPoints" value="false" />
		<parameter name="canUseScrolls" value="false" />
		<parameter name="canUsePotions" value="false" />
		<parameter name="canItemSummons" value="false" />
		<parameter name="canUseCommunity" value="true" /> <!-- if false will block buffer and other community services -->
		<parameter name="rootBetweenRounds" value="true" />
		<parameter name="loseBuffsOnDeath" value="false" />
		<parameter name="excludedClasses" value="HEALERS" />
		<parameter name="validLevels" value="75-85" /> <!-- Valid levels diff -->
		<parameter name="validProffs" value="2;3" /> <!-- Valid proffs levels list -->
		<parameter name="respawnTime" value="5" />
		<parameter name="ressAllowed" value="false" />
		<!-- better to make different rewards for different positions -->
		<!-- can use several items in one position -->
		<parameter name="rewardByParticipation" value="57,100000" />
		<parameter name="rewardByKillPlayer" value="4037,1" />
		<parameter name="rewardByTopKiller" value="4037,5" />
		<parameter name="rewardByOpenChest" value="4037,1" />
		<parameter name="scoreForChest" value="1" /> <!-- need for calc rewardByWinner param if use -->
		<parameter name="scoreForKilledPlayer" value="0" /> <!-- need for calc rewardByWinner param if use -->
		<parameter name="numberOfChests" value="7" />
		<parameter name="timeForRespawningChest" value="15" />
		<parameter name="instanced" value="true" />
		<parameter name="isUseEventItems" value="false" />
		<!-- check and unequip items from slot numbers -->
		<parameter name="checkItemSlots" value="23;0;8;9;4;13;14;1;5;7;10;6;11;12;2;3;17;18;19;20;21;16;15;24" />
		<!-- Example event items by classes -->
		<eventItems>
			<class id="106"> <!-- Shillien Templar -->
				<itemList>
					<item id="14120" amount="1" enchant="16" augmentation="16340:13400" elementals="0:300" /> <!-- Vesper Cutter -->
					<item id="13435" amount="1" /> <!-- Vesper Noble Breastplate -->
					<item id="13448" amount="1" /> <!-- Vesper Noble Gaiters -->
					<item id="13140" amount="1" /> <!-- Vesper Noble Helmet -->
                			<item id="13450" amount="1" /> <!-- Vesper Noble Boots -->
               				<item id="13449" amount="1" /> <!-- Vesper Noble Gauntlet -->
                			<item id="13471" amount="1" /> <!-- Vesper Shield -->
                			<item id="14164" amount="1" /> <!-- Vesper Necklace -->
					<item id="16376" amount="1" /> <!-- Vesper Earring -->
					<item id="16376" amount="1" /> <!-- Vesper Earring -->
					<item id="14165" amount="1" /> <!-- Vesper Ring -->
					<item id="14165" amount="1" /> <!-- Vesper Ring -->
				</itemList>
			</class>
			<class id="90"> <!-- Phoenix Knight -->
				<itemList>
					<item id="14120" amount="1" enchant="16" augmentation="16340:13400" elementals="0:300" /> <!-- Vesper Cutter -->
					<item id="13435" amount="1" /> <!-- Vesper Noble Breastplate -->
					<item id="13448" amount="1" /> <!-- Vesper Noble Gaiters -->
					<item id="13140" amount="1" /> <!-- Vesper Noble Helmet -->
                			<item id="13450" amount="1" /> <!-- Vesper Noble Boots -->
               				<item id="13449" amount="1" /> <!-- Vesper Noble Gauntlet -->
                			<item id="13471" amount="1" /> <!-- Vesper Shield -->
                			<item id="14164" amount="1" /> <!-- Vesper Necklace -->
					<item id="16376" amount="1" /> <!-- Vesper Earring -->
					<item id="16376" amount="1" /> <!-- Vesper Earring -->
					<item id="14165" amount="1" /> <!-- Vesper Ring -->
					<item id="14165" amount="1" /> <!-- Vesper Ring -->
				</itemList>
			</class>
		</eventItems>
	</event>
</list>